{
  "scem_schema_version": "1.0",
  "model": {
    "path": "geometry/target.obj",
    "units": "m"
  },
  "frequency": {
    "frequency_hz": 10000000000
  },
  "angles": {
    "azimuth": {
      "start": 0,
      "stop": 0,
      "step": 1
    },
    "elevation": {
      "start": -90,
      "stop": -90,
      "step": 1
    }
  },
  "solver": {
    "type": "PO"
  },
  "output": {
    "path": "pkg.h5"
  },
  "integration": {
    "designer": {
      "design_id": "someone-else",
      "revision": "7"
    }
  }
}