{
  "scem_schema_version": "1.0",
  "model": {"path": "plate_fine.stl"},
  "frequency": {"frequency_hz": 300000000},
  "angles": {
    "azimuth": {"start": 0, "stop": 0, "step": 1},
    "elevation": {"start": -90, "stop": -90, "step": 1}
  },
  "solver": {"type": "PO"},
  "output": {"path": "x.h5"}
}
